{
  "$schema": "https://json-schema.org/draft/2020-12/schema",
  "properties": {
    "metadata": {
      "type": "object"
    },
    "missing": {
      "type": "array"
    },
    "rows": {
      "type": "array"
    },
    "summary_by_task": {
      "type": "object"
    }
  },
  "required": [
    "metadata",
    "rows",
    "summary_by_task",
    "missing"
  ],
  "title": "Paper 1 unseen perturbation Phase-0 ACPC subset",
  "type": "object"
}