{
  "metadata": {
    "cases": [
      "TwoRoom:gaussian_blur:15",
      "TwoRoom:resize:0.25",
      "PushT:gaussian_blur:15",
      "PushT:resize:0.25",
      "Reacher:gaussian_blur:15",
      "Reacher:resize:0.25",
      "Cube:gaussian_blur:15",
      "Cube:resize:0.25"
    ],
    "created_utc": "2026-07-04T05:06:49.898666+00:00",
    "phase0_protocol": {
      "goal": "clean",
      "higher_is_better": [
        "cra_spearman_mean",
        "elite_overlap_mean",
        "sprr"
      ],
      "lower_is_better": [
        "acpc_h_norm_by_transition",
        "pcc_abs_median",
        "maf_flip_rate"
      ],
      "paired_corruption": "observation history only",
      "std_keys": [
        "0.0",
        "0.08"
      ]
    },
    "schema_version": "paper1-unseen-phase0-acpc-subset-1.0",
    "seeds": [
      3072,
      3073,
      3074
    ],
    "status": "review artifact; supports appendix boundary analysis, not the main Gaussian claim",
    "unseen_artifact_template": "assets/paper1_data/unseen_origin_vs_std008_strongest_s{seed}.json"
  },
  "missing": [],
  "rows": [
    {
      "case": "TwoRoom:gaussian_blur:15",
      "diagnostics": {
        "baseline_acpc_h_l2_median": 19.217445373535156,
        "baseline_acpc_h_norm_by_transition": 1.3491862481365036,
        "baseline_cra_spearman_mean": 0.19129063189029694,
        "baseline_elite_overlap_mean": 0.2162500023841858,
        "baseline_encoder_shift_to_nn_l2": 13.730433599712603,
        "baseline_maf_flip_rate": 0.949999988079071,
        "baseline_pcc_abs_median": 60.639129638671875,
        "baseline_sprr": 0.9919275272750828,
        "baseline_status": "ok",
        "delta_acpc_h_l2_median": -13.281057357788086,
        "delta_acpc_h_norm_by_transition": -0.8923642389693197,
        "delta_cra_spearman_mean": 0.7127346843481064,
        "delta_elite_overlap_mean": 0.5550000071525574,
        "delta_encoder_shift_to_nn_l2": -10.825116726191109,
        "delta_maf_flip_rate": -0.5199999809265137,
        "delta_pcc_abs_median": -48.77278137207031,
        "delta_sprr": 2.175780620996186,
        "diagnostic_improvement_count": 5,
        "directional_checks": {
          "acpc_lower": true,
          "cra_higher": true,
          "elite_overlap_higher": true,
          "maf_lower": true,
          "pcc_lower": true
        },
        "status": "ok",
        "std008_acpc_h_l2_median": 5.93638801574707,
        "std008_acpc_h_norm_by_transition": 0.45682200916718385,
        "std008_cra_spearman_mean": 0.9040253162384033,
        "std008_elite_overlap_mean": 0.7712500095367432,
        "std008_encoder_shift_to_nn_l2": 2.905316873521495,
        "std008_maf_flip_rate": 0.4300000071525574,
        "std008_pcc_abs_median": 11.866348266601562,
        "std008_sprr": 3.167708148271269,
        "std008_status": "ok"
      },
      "eval": {
        "baseline_drop": 52.666667000000004,
        "baseline_origin_success": 93.666667,
        "baseline_stress_success": 41.0,
        "drop_improvement": 52.33333400000001,
        "primary_stress_group": "pixels_blur_ks15",
        "std008_drop": 0.3333329999999961,
        "std008_origin_success": 97.0,
        "std008_stress_success": 96.666667,
        "stress_success_delta": 55.666667000000004
      },
      "family": "gaussian_blur",
      "magnitude": 15.0,
      "raw_phase0_artifact": "assets/paper1_data/unseen_phase0_acpc_subset_raw/seed3072_tworoom_gaussian_blur.json",
      "reading": "positive_transfer_with_diagnostic_alignment",
      "seed": 3072,
      "task": "TwoRoom"
    },
    {
      "case": "TwoRoom:resize:0.25",
      "diagnostics": {
        "baseline_acpc_h_l2_median": 19.164268493652344,
        "baseline_acpc_h_norm_by_transition": 1.3454528947348334,
        "baseline_cra_spearman_mean": 0.20377491414546967,
        "baseline_elite_overlap_mean": 0.2462500035762787,
        "baseline_encoder_shift_to_nn_l2": 12.788925830148354,
        "baseline_maf_flip_rate": 0.949999988079071,
        "baseline_pcc_abs_median": 59.02647399902344,
        "baseline_sprr": 0.9946799209268578,
        "baseline_status": "ok",
        "delta_acpc_h_l2_median": -15.799992799758911,
        "delta_acpc_h_norm_by_transition": -1.0865622734007916,
        "delta_cra_spearman_mean": 0.7499615103006363,
        "delta_elite_overlap_mean": 0.5962499678134918,
        "delta_encoder_shift_to_nn_l2": -10.818135586703752,
        "delta_maf_flip_rate": -0.6699999868869781,
        "delta_pcc_abs_median": -52.11576843261719,
        "delta_sprr": 4.594857434378624,
        "diagnostic_improvement_count": 5,
        "directional_checks": {
          "acpc_lower": true,
          "cra_higher": true,
          "elite_overlap_higher": true,
          "maf_lower": true,
          "pcc_lower": true
        },
        "status": "ok",
        "std008_acpc_h_l2_median": 3.3642756938934326,
        "std008_acpc_h_norm_by_transition": 0.25889062133404195,
        "std008_cra_spearman_mean": 0.953736424446106,
        "std008_elite_overlap_mean": 0.8424999713897705,
        "std008_encoder_shift_to_nn_l2": 1.970790243444603,
        "std008_maf_flip_rate": 0.2800000011920929,
        "std008_pcc_abs_median": 6.91070556640625,
        "std008_sprr": 5.589537355305482,
        "std008_status": "ok"
      },
      "eval": {
        "baseline_drop": 49.333334,
        "baseline_origin_success": 93.666667,
        "baseline_stress_success": 44.333333,
        "drop_improvement": 49.000001000000005,
        "primary_stress_group": "pixels_rs_factor0.25",
        "std008_drop": 0.3333329999999961,
        "std008_origin_success": 97.0,
        "std008_stress_success": 96.666667,
        "stress_success_delta": 52.333334
      },
      "family": "resize",
      "magnitude": 0.25,
      "raw_phase0_artifact": "assets/paper1_data/unseen_phase0_acpc_subset_raw/seed3072_tworoom_resize.json",
      "reading": "positive_transfer_with_diagnostic_alignment",
      "seed": 3072,
      "task": "TwoRoom"
    },
    {
      "case": "PushT:gaussian_blur:15",
      "diagnostics": {
        "baseline_acpc_h_l2_median": 6.259004592895508,
        "baseline_acpc_h_norm_by_transition": 1.0522818641511684,
        "baseline_cra_spearman_mean": 0.9054321050643921,
        "baseline_elite_overlap_mean": 0.7287499904632568,
        "baseline_encoder_shift_to_nn_l2": 1.3770869393431675,
        "baseline_maf_flip_rate": 0.30000001192092896,
        "baseline_pcc_abs_median": 18.258056640625,
        "baseline_sprr": 3.1046993097781286,
        "baseline_status": "ok",
        "delta_acpc_h_l2_median": -1.7506399154663086,
        "delta_acpc_h_norm_by_transition": -0.23617916913020376,
        "delta_cra_spearman_mean": 0.015690267086029053,
        "delta_elite_overlap_mean": 0.04874998331069946,
        "delta_encoder_shift_to_nn_l2": -0.2964158082377488,
        "delta_maf_flip_rate": -0.10000000894069672,
        "delta_pcc_abs_median": -4.210884094238281,
        "delta_sprr": 1.2318536383512928,
        "diagnostic_improvement_count": 5,
        "directional_checks": {
          "acpc_lower": true,
          "cra_higher": true,
          "elite_overlap_higher": true,
          "maf_lower": true,
          "pcc_lower": true
        },
        "status": "ok",
        "std008_acpc_h_l2_median": 4.508364677429199,
        "std008_acpc_h_norm_by_transition": 0.8161026950209647,
        "std008_cra_spearman_mean": 0.9211223721504211,
        "std008_elite_overlap_mean": 0.7774999737739563,
        "std008_encoder_shift_to_nn_l2": 1.0806711311054187,
        "std008_maf_flip_rate": 0.20000000298023224,
        "std008_pcc_abs_median": 14.047172546386719,
        "std008_sprr": 4.336552948129421,
        "std008_status": "ok"
      },
      "eval": {
        "baseline_drop": 20.666666999999997,
        "baseline_origin_success": 82.0,
        "baseline_stress_success": 61.333333,
        "drop_improvement": 4.333334000000001,
        "primary_stress_group": "pixels_blur_ks15",
        "std008_drop": 16.333332999999996,
        "std008_origin_success": 88.333333,
        "std008_stress_success": 72.0,
        "stress_success_delta": 10.666666999999997
      },
      "family": "gaussian_blur",
      "magnitude": 15.0,
      "raw_phase0_artifact": "assets/paper1_data/unseen_phase0_acpc_subset_raw/seed3072_pusht_gaussian_blur.json",
      "reading": "positive_transfer_with_diagnostic_alignment",
      "seed": 3072,
      "task": "PushT"
    },
    {
      "case": "PushT:resize:0.25",
      "diagnostics": {
        "baseline_acpc_h_l2_median": 5.061180114746094,
        "baseline_acpc_h_norm_by_transition": 0.8509001658179094,
        "baseline_cra_spearman_mean": 0.9358893632888794,
        "baseline_elite_overlap_mean": 0.8025000095367432,
        "baseline_encoder_shift_to_nn_l2": 1.2685330613473111,
        "baseline_maf_flip_rate": 0.1599999964237213,
        "baseline_pcc_abs_median": 16.484352111816406,
        "baseline_sprr": 3.8394854147742237,
        "baseline_status": "ok",
        "delta_acpc_h_l2_median": -2.047196865081787,
        "delta_acpc_h_norm_by_transition": -0.30530990664622026,
        "delta_cra_spearman_mean": 0.01343446969985962,
        "delta_elite_overlap_mean": 0.02249997854232788,
        "delta_encoder_shift_to_nn_l2": -0.5509256516177456,
        "delta_maf_flip_rate": 0.040000006556510925,
        "delta_pcc_abs_median": -7.101737976074219,
        "delta_sprr": 2.647200307126969,
        "diagnostic_improvement_count": 4,
        "directional_checks": {
          "acpc_lower": true,
          "cra_higher": true,
          "elite_overlap_higher": true,
          "maf_lower": false,
          "pcc_lower": true
        },
        "status": "ok",
        "std008_acpc_h_l2_median": 3.0139832496643066,
        "std008_acpc_h_norm_by_transition": 0.5455902591716891,
        "std008_cra_spearman_mean": 0.949323832988739,
        "std008_elite_overlap_mean": 0.824999988079071,